{
  "$schema": "https://json-schema.org/draft/2020-12/schema",
  "$id": "urn:pto-isa:agentic-circuit:schema:block-spec:0.4",
  "title": "Agentic Circuit High-Level BlockSpec 0.4",
  "type": "object",
  "additionalProperties": false,
  "required": ["schema", "version", "contract_epoch", "blocks"],
  "properties": {
    "schema": {"const": "agentic-circuit-block-spec"},
    "version": {"const": "0.4"},
    "contract_epoch": {"const": "0.4"},
    "blocks": {
      "type": "array",
      "minItems": 1,
      "items": {"$ref": "#/$defs/block"}
    }
  },
  "$defs": {
    "name": {
      "type": "string",
      "pattern": "^[a-z][a-z0-9_]*$"
    },
    "operation": {
      "type": "string",
      "pattern": "^ac\\.[a-z][a-z0-9_]*(?:\\.[a-z][a-z0-9_]*)*$"
    },
    "arity": {
      "type": "object",
      "additionalProperties": false,
      "required": ["min", "max"],
      "properties": {
        "min": {"type": "integer", "minimum": 0},
        "max": {
          "oneOf": [
            {"type": "integer", "minimum": 0},
            {"type": "null"}
          ]
        }
      }
    },
    "portGroup": {
      "type": "object",
      "additionalProperties": false,
      "required": ["name", "direction", "arity", "payload", "ownership"],
      "properties": {
        "name": {"$ref": "#/$defs/name"},
        "direction": {"enum": ["in", "out"]},
        "arity": {"$ref": "#/$defs/arity"},
        "payload": {
          "enum": [
            "input",
            "output",
            "all_equal",
            "region_yield"
          ]
        },
        "ownership": {"const": "borrowed_simqueue"}
      }
    },
    "parameter": {
      "type": "object",
      "additionalProperties": false,
      "required": [
        "name",
        "kind",
        "required",
        "default",
        "cpp_mapping",
        "verilog_mapping"
      ],
      "properties": {
        "name": {"$ref": "#/$defs/name"},
        "kind": {
          "enum": ["type", "structural", "policy", "instance", "field"]
        },
        "required": {"type": "boolean"},
        "default": true,
        "cpp_mapping": {
          "enum": [
            "inferred_template_type",
            "template_argument",
            "constexpr_argument",
            "constructor_constant",
            "typed_accessor"
          ]
        },
        "verilog_mapping": {
          "enum": [
            "inferred_packed_type",
            "parameter",
            "localparam",
            "generate_policy",
            "packed_field_slice",
            "requires_lane_lowering"
          ]
        }
      }
    },
    "cppProvider": {
      "type": "object",
      "additionalProperties": false,
      "required": ["header", "symbol", "optimized"],
      "properties": {
        "header": {"type": "string", "minLength": 1},
        "symbol": {"type": "string", "minLength": 1},
        "optimized": {"const": true}
      }
    },
    "verilogProvider": {
      "type": "object",
      "additionalProperties": false,
      "required": ["realization", "optimized"],
      "properties": {
        "realization": {"type": "string", "minLength": 1},
        "optimized": {"const": true}
      }
    },
    "providers": {
      "type": "object",
      "additionalProperties": false,
      "required": ["cpp", "verilog"],
      "properties": {
        "cpp": {"$ref": "#/$defs/cppProvider"},
        "verilog": {"$ref": "#/$defs/verilogProvider"}
      }
    },
    "block": {
      "type": "object",
      "additionalProperties": false,
      "required": [
        "name",
        "operation",
        "lowers_to",
        "category",
        "lambda_regions",
        "ports",
        "parameters",
        "providers",
        "refinement_observations"
      ],
      "properties": {
        "name": {"$ref": "#/$defs/name"},
        "operation": {"$ref": "#/$defs/operation"},
        "lowers_to": {
          "oneOf": [
            {"$ref": "#/$defs/operation"},
            {
              "type": "array",
              "minItems": 1,
              "items": {"$ref": "#/$defs/operation"},
              "uniqueItems": true
            }
          ]
        },
        "category": {
          "enum": ["compute", "transport", "scheduling", "execution", "storage"]
        },
        "lambda_regions": {"type": "integer", "minimum": 0, "maximum": 1},
        "ports": {
          "type": "array",
          "minItems": 2,
          "items": {"$ref": "#/$defs/portGroup"}
        },
        "parameters": {
          "type": "array",
          "items": {"$ref": "#/$defs/parameter"}
        },
        "providers": {"$ref": "#/$defs/providers"},
        "refinement_observations": {
          "type": "array",
          "minItems": 1,
          "items": {"$ref": "#/$defs/name"},
          "uniqueItems": true
        }
      }
    }
  }
}
