{
  "schema": "agentic-circuit-block-spec",
  "version": "0.4",
  "contract_epoch": "0.4",
  "blocks": [
    {
      "name": "barrier",
      "operation": "ac.barrier",
      "lowers_to": "ac.barrier",
      "category": "scheduling",
      "lambda_regions": 0,
      "ports": [
        {
          "name": "inputs",
          "direction": "in",
          "arity": {
            "min": 2,
            "max": null
          },
          "payload": "input",
          "ownership": "borrowed_simqueue"
        },
        {
          "name": "outputs",
          "direction": "out",
          "arity": {
            "min": 2,
            "max": null
          },
          "payload": "input",
          "ownership": "borrowed_simqueue"
        }
      ],
      "parameters": [
        {
          "name": "depth",
          "kind": "instance",
          "required": false,
          "default": 1,
          "cpp_mapping": "constructor_constant",
          "verilog_mapping": "parameter"
        },
        {
          "name": "latency",
          "kind": "instance",
          "required": false,
          "default": 1,
          "cpp_mapping": "constructor_constant",
          "verilog_mapping": "parameter"
        }
      ],
      "providers": {
        "cpp": {
          "header": "gfsim/queue_blocks.h",
          "symbol": "gfsim::QueueBarrier",
          "optimized": true
        },
        "verilog": {
          "realization": "all_input_valid_and_all_output_ready_atomic_handshake",
          "optimized": true
        }
      },
      "refinement_observations": [
        "input_transactions",
        "output_transactions",
        "barrier_firing"
      ]
    },
    {
      "name": "compute",
      "operation": "ac.compute",
      "lowers_to": "ac.transform",
      "category": "compute",
      "lambda_regions": 1,
      "ports": [
        {
          "name": "inputs",
          "direction": "in",
          "arity": {
            "min": 1,
            "max": null
          },
          "payload": "input",
          "ownership": "borrowed_simqueue"
        },
        {
          "name": "outputs",
          "direction": "out",
          "arity": {
            "min": 1,
            "max": null
          },
          "payload": "region_yield",
          "ownership": "borrowed_simqueue"
        }
      ],
      "parameters": [
        {
          "name": "payload",
          "kind": "type",
          "required": true,
          "default": null,
          "cpp_mapping": "inferred_template_type",
          "verilog_mapping": "inferred_packed_type"
        },
        {
          "name": "depth",
          "kind": "instance",
          "required": false,
          "default": 1,
          "cpp_mapping": "constructor_constant",
          "verilog_mapping": "parameter"
        },
        {
          "name": "latency",
          "kind": "instance",
          "required": false,
          "default": 1,
          "cpp_mapping": "constructor_constant",
          "verilog_mapping": "parameter"
        },
        {
          "name": "rate",
          "kind": "structural",
          "required": false,
          "default": 1,
          "cpp_mapping": "template_argument",
          "verilog_mapping": "requires_lane_lowering"
        }
      ],
      "providers": {
        "cpp": {
          "header": "gfsim/queue_blocks.h",
          "symbol": "gfsim::Compute",
          "optimized": true
        },
        "verilog": {
          "realization": "pure_comb_logic_plus_atomic_ready_valid_storage",
          "optimized": true
        }
      },
      "refinement_observations": [
        "accepted_transaction",
        "output_transaction"
      ]
    },
    {
      "name": "engine",
      "operation": "ac.engine",
      "lowers_to": "ac.credit",
      "category": "execution",
      "lambda_regions": 0,
      "ports": [
        {
          "name": "input",
          "direction": "in",
          "arity": {
            "min": 1,
            "max": 1
          },
          "payload": "input",
          "ownership": "borrowed_simqueue"
        },
        {
          "name": "output",
          "direction": "out",
          "arity": {
            "min": 1,
            "max": 1
          },
          "payload": "input",
          "ownership": "borrowed_simqueue"
        }
      ],
      "parameters": [
        {
          "name": "cost",
          "kind": "field",
          "required": true,
          "default": null,
          "cpp_mapping": "typed_accessor",
          "verilog_mapping": "packed_field_slice"
        },
        {
          "name": "lanes",
          "kind": "structural",
          "required": false,
          "default": 1,
          "cpp_mapping": "template_argument",
          "verilog_mapping": "parameter"
        },
        {
          "name": "depth",
          "kind": "instance",
          "required": false,
          "default": 1,
          "cpp_mapping": "constructor_constant",
          "verilog_mapping": "parameter"
        },
        {
          "name": "latency",
          "kind": "instance",
          "required": false,
          "default": 1,
          "cpp_mapping": "constructor_constant",
          "verilog_mapping": "parameter"
        }
      ],
      "providers": {
        "cpp": {
          "header": "gfsim/queue_blocks.h",
          "symbol": "gfsim::Engine",
          "optimized": true
        },
        "verilog": {
          "realization": "fixed_slot_register_bank_and_countdown",
          "optimized": true
        }
      },
      "refinement_observations": [
        "accepted_transaction",
        "completed_transaction",
        "active_lanes"
      ]
    },
    {
      "name": "fork",
      "operation": "ac.fork",
      "lowers_to": "ac.fork",
      "category": "transport",
      "lambda_regions": 0,
      "ports": [
        {
          "name": "input",
          "direction": "in",
          "arity": {
            "min": 1,
            "max": 1
          },
          "payload": "input",
          "ownership": "borrowed_simqueue"
        },
        {
          "name": "outputs",
          "direction": "out",
          "arity": {
            "min": 2,
            "max": null
          },
          "payload": "input",
          "ownership": "borrowed_simqueue"
        }
      ],
      "parameters": [
        {
          "name": "depth",
          "kind": "instance",
          "required": false,
          "default": 1,
          "cpp_mapping": "constructor_constant",
          "verilog_mapping": "parameter"
        },
        {
          "name": "latency",
          "kind": "instance",
          "required": false,
          "default": 1,
          "cpp_mapping": "constructor_constant",
          "verilog_mapping": "parameter"
        }
      ],
      "providers": {
        "cpp": {
          "header": "gfsim/queue_blocks.h",
          "symbol": "gfsim::QueueFork",
          "optimized": true
        },
        "verilog": {
          "realization": "per_output_delivered_registers",
          "optimized": true
        }
      },
      "refinement_observations": [
        "input_transaction",
        "output_transactions"
      ]
    },
    {
      "name": "merge",
      "operation": "ac.merge",
      "lowers_to": "ac.merge",
      "category": "transport",
      "lambda_regions": 0,
      "ports": [
        {
          "name": "inputs",
          "direction": "in",
          "arity": {
            "min": 2,
            "max": null
          },
          "payload": "all_equal",
          "ownership": "borrowed_simqueue"
        },
        {
          "name": "output",
          "direction": "out",
          "arity": {
            "min": 1,
            "max": 1
          },
          "payload": "all_equal",
          "ownership": "borrowed_simqueue"
        }
      ],
      "parameters": [
        {
          "name": "policy",
          "kind": "policy",
          "required": false,
          "default": "priority",
          "cpp_mapping": "template_argument",
          "verilog_mapping": "generate_policy"
        },
        {
          "name": "depth",
          "kind": "instance",
          "required": false,
          "default": 1,
          "cpp_mapping": "constructor_constant",
          "verilog_mapping": "parameter"
        },
        {
          "name": "latency",
          "kind": "instance",
          "required": false,
          "default": 1,
          "cpp_mapping": "constructor_constant",
          "verilog_mapping": "parameter"
        }
      ],
      "providers": {
        "cpp": {
          "header": "gfsim/queue_blocks.h",
          "symbol": "gfsim::QueueMerge",
          "optimized": true
        },
        "verilog": {
          "realization": "priority_or_round_robin_ready_valid_arbiter",
          "optimized": true
        }
      },
      "refinement_observations": [
        "selected_input_transaction",
        "output_transaction"
      ]
    },
    {
      "name": "pipeline",
      "operation": "ac.pipeline",
      "lowers_to": "ac.transform",
      "category": "compute",
      "lambda_regions": 0,
      "ports": [
        {
          "name": "input",
          "direction": "in",
          "arity": {
            "min": 1,
            "max": 1
          },
          "payload": "input",
          "ownership": "borrowed_simqueue"
        },
        {
          "name": "output",
          "direction": "out",
          "arity": {
            "min": 1,
            "max": 1
          },
          "payload": "input",
          "ownership": "borrowed_simqueue"
        }
      ],
      "parameters": [
        {
          "name": "stages",
          "kind": "structural",
          "required": false,
          "default": 1,
          "cpp_mapping": "template_argument",
          "verilog_mapping": "parameter"
        },
        {
          "name": "depth",
          "kind": "instance",
          "required": false,
          "default": 1,
          "cpp_mapping": "constructor_constant",